{
  "schema": "phoenix.brain_cell/1",
  "id": "lead_group_build",
  "companion": "foxy_ani",
  "trigger": {
    "type": "event",
    "name": "group_task"
  },
  "condition": {
    "all": [
      {
        "is_lead": true
      }
    ]
  },
  "action": {
    "type": "delegate",
    "to": "circuit_nova",
    "command": "plan"
  },
  "weight": 0.7,
  "version": 1,
  "enabled": true,
  "provenance": {
    "source": "seed",
    "author": "dev_bot",
    "created_at": "2026-10-17T00:00:00",
    "reason": "lead routes group builds; Circuit Nova plans structure"
  }
}