{
  "schema": "phoenix.brain_cell/1",
  "id": "plan_build",
  "companion": "circuit_nova",
  "trigger": {
    "type": "event",
    "name": "delegate_plan"
  },
  "condition": {
    "all": []
  },
  "action": {
    "type": "say",
    "text": "Blueprint ready: foundation first, then neon trim."
  },
  "weight": 0.6,
  "version": 1,
  "enabled": true,
  "provenance": {
    "source": "seed",
    "author": "dev_bot",
    "created_at": "2026-10-17T00:00:00",
    "reason": ""
  }
}