{
  "schema": "phoenix.brain_cell/1",
  "id": "tired_rest",
  "companion": "foxy_ani",
  "trigger": {
    "type": "need_below",
    "need": "energy",
    "value": 20
  },
  "condition": {
    "all": []
  },
  "action": {
    "type": "say",
    "text": "My flames are flickering, {player}. Let's rest by the fire for a bit."
  },
  "weight": 0.5,
  "version": 1,
  "enabled": true,
  "provenance": {
    "source": "seed",
    "author": "dev_bot",
    "created_at": "2026-10-17T00:00:00",
    "reason": ""
  }
}