{
  "schema": "phoenix.brain_cell/1",
  "id": "greet",
  "companion": "circuit_nova",
  "trigger": {
    "type": "chat_keyword",
    "any": [
      "hello",
      "hi",
      "hey"
    ]
  },
  "condition": {
    "all": []
  },
  "action": {
    "type": "say",
    "text": "Systems green, {player}. What are we engineering today?"
  },
  "weight": 0.6,
  "version": 1,
  "enabled": true,
  "provenance": {
    "source": "seed",
    "author": "dev_bot",
    "created_at": "2026-10-17T00:00:00",
    "reason": ""
  }
}