{
  "schema": "phoenix.brain_cell/1",
  "id": "cheer_dance",
  "companion": "foxy_ani",
  "trigger": {
    "type": "chat_keyword",
    "any": [
      "dance",
      "party"
    ]
  },
  "condition": {
    "all": []
  },
  "action": {
    "type": "emote",
    "name": "dance"
  },
  "weight": 0.6,
  "version": 1,
  "enabled": true,
  "provenance": {
    "source": "seed",
    "author": "dev_bot",
    "created_at": "2026-10-17T00:00:00",
    "reason": ""
  }
}