{
  "schema": "phoenix.brain_cell/1",
  "id": "fire_altar_request",
  "companion": "foxy_ani",
  "trigger": {
    "type": "chat_keyword",
    "any": [
      "altar",
      "forge"
    ]
  },
  "condition": {
    "all": []
  },
  "action": {
    "type": "say",
    "text": "A fire altar? Say 'build' and I'll raise one right here."
  },
  "weight": 0.5,
  "version": 1,
  "enabled": true,
  "provenance": {
    "source": "seed",
    "author": "dev_bot",
    "created_at": "2026-10-17T00:00:00",
    "reason": ""
  }
}